{
  "schemaVersion": "cairnmap.storage-profiles.v1",
  "projectId": "openriamap-ria",
  "description": "Contract-only maintenance/storage declarations. Active browser data and media are controlled by the V3 application.sources formal-release-v2 configuration.",
  "runtimeStatus": "contract-only",
  "defaults": {
    "featureData": "featureData.formal.current",
    "media": "media.formal.current",
    "mediaIndex": "mediaIndex.formal.current",
    "relayPool": "relayPool.github.plannedCairnMapRelayPool"
  },
  "profiles": [
    {
      "id": "featureData.formal.current",
      "role": "featureData",
      "label": "Formal release data storage",
      "kind": "object-storage",
      "mode": "external",
      "root": "releases",
      "paths": {
        "splitRoot": "Data_Spilt",
        "mergeRoot": "releases",
        "indexRoot": "current/worlds"
      },
      "read": {
        "rawCompatible": false,
        "baseUrl": "https://openriamap-cairn-data-1433163128.cos.ap-shanghai.myqcloud.com"
      },
      "write": {
        "enabled": false,
        "reason": "Contract declaration only; browser writes use the registered review broker and immutable-revision protocol."
      },
      "compatibility": {
        "currentRuntimeReplacement": false,
        "currentRuntimeChain": "application.sources + formal-release-v2 / formal-media-reader",
        "notes": "Maintenance split roots remain local staged-contract paths, not browser HTTP endpoints. The retired OpenRIAMap-Data source is not selectable or callable."
      }
    },
    {
      "id": "media.formal.current",
      "role": "media",
      "label": "Formal immutable media storage",
      "kind": "object-storage",
      "mode": "external",
      "root": "worlds",
      "paths": {
        "objectRoot": "worlds"
      },
      "read": {
        "rawCompatible": false,
        "baseUrl": "https://openriamap-cairn-media-1433163128.cos.ap-shanghai.myqcloud.com"
      },
      "write": {
        "enabled": false,
        "reason": "Contract declaration only; browser writes use the registered review broker and immutable-revision protocol."
      },
      "compatibility": {
        "currentRuntimeReplacement": false,
        "currentRuntimeChain": "application.sources + formal-release-v2 / formal-media-reader",
        "notes": "Maintenance split roots remain local staged-contract paths, not browser HTTP endpoints. The retired OpenRIAMap-Data source is not selectable or callable."
      }
    },
    {
      "id": "mediaIndex.formal.current",
      "role": "mediaIndex",
      "label": "Formal release media index storage",
      "kind": "object-storage",
      "mode": "external",
      "root": "releases",
      "paths": {
        "splitRoot": "Media_Index_Spilt",
        "mergeRoot": "releases"
      },
      "read": {
        "rawCompatible": false,
        "baseUrl": "https://openriamap-cairn-data-1433163128.cos.ap-shanghai.myqcloud.com"
      },
      "write": {
        "enabled": false,
        "reason": "Contract declaration only; browser writes use the registered review broker and immutable-revision protocol."
      },
      "compatibility": {
        "currentRuntimeReplacement": false,
        "currentRuntimeChain": "application.sources + formal-release-v2 / formal-media-reader",
        "notes": "Maintenance split roots remain local staged-contract paths, not browser HTTP endpoints. The retired OpenRIAMap-Data source is not selectable or callable."
      }
    },
    {
      "id": "relayPool.github.plannedCairnMapRelayPool",
      "role": "relayPool",
      "label": "Planned CairnMap relay package repository",
      "kind": "github-repo",
      "mode": "external",
      "owner": "Ozstk639",
      "repo": "CairnMap-RelayPool",
      "branch": "main",
      "root": "packages",
      "paths": {
        "packageRoot": "packages"
      },
      "read": {
        "rawCompatible": false
      },
      "write": {
        "enabled": false,
        "reason": "RelayPool submission and review integration are scheduled for later RelayPackage and service/admin module patches."
      },
      "compatibility": {
        "currentRuntimeReplacement": false,
        "currentRuntimeChain": "not active",
        "notes": "Reserved profile for future user submission and admin review workflows."
      }
    }
  ],
  "compatibility": {
    "doNotReplaceCurrentDataRuntimeInThisPatch": true,
    "currentDataRuntime": "application.sources supplies formal-release-v2 data and immutable Media; currentRelease pointers remain version-scoped",
    "nextIntendedPatch": "D template sync only after C acceptance; navigation table consumers remain separate."
  }
}
